<?xml version="1.0" encoding="UTF-8"?>
<metro xmlns="http://shdwrazedev.com/metro"
       xmlns:xsi="http://www.w3.org/2001/XMLSchema-instance"
       xsi:schemaLocation="http://shdwrazedev.com/metro metro.xsd">
    <station id="1">
        <name>Naukova</name>
        <line>Oleksiivska</line>
        <city>Kharkiv</city>
    </station>
    <station id="2">
        <name>Universytet</name>
        <line>Saltivska</line>
        <city>Kharkiv</city>
    </station>
    <station id="3">
        <name>Kholodna Hora</name>
        <line>Kholodnohirsko-Zavodska</line>
        <city>Kharkiv</city>
    </station>
    <station id="4">
        <name>Istorychnyi Muzei</name>
        <line>Saltivska</line>
        <city>Kharkiv</city>
    </station>
</metro>
